urdu_text,roman_text
ہم اپنی رندی و طاعت پہ خاک ناز کریں,idhar se bhi hai siva kuchh udhar ki majburi
کہا جو میں نے کہ مر جاؤں گا تو کہتے ہیں,jo aadmi pe guzri vo ik siva tumhare
آج اچھی طرح سے مجھے پہچان لیجیے,aaj achchhi tarah se mujhe pahchan lijiye
ہیں میری پیاس کے پھونکے ہویے یہ ویرانے,tum kyuun unhen chhede ja rahe ho
لگایے خانۂ آیینہ میں رویے نگار آتش,tiri taraf hai ba hasrat nazara e nargis
سنا ہے اس کے شبستاں سے متصل ہے بہشت,suna hai us ke shabistan se muttasil hai bahisht
غار میں ہاتھ نہ ڈالو کہیں راتیں نکلیں,raat kaate koi kidhar tanha
بہت خوش ہو کہ اس نے کچھ کہا ہے,main khush rahta agar samjha na hota
غم و رنج و الم نکو یاں سے,ji men kya kya hai apne ai hamdam
کچھ کہہ نہیں سکتا ہوں زباں سے کہ ذرا دیکھ,suno tum apni jo tegh e nigah ke ausaf
کہ آپ آنسو بہاتے سامنے دشمن کے بیٹھے ہیں,azimabad men ham muntazir savan ke baithe hain
کیوں ہمیں کر دیا گیا مجبور,khuun ke ghunt pi raha huun main
عیش ہے عیش کہ اس مہ کا خیال روشن,jab apni raah chalta hai akela hone lagta hai
ڈھونڈے گا کہاں چاندنی راتوں کا کفن تو,jab hijr ke shahr men dhuup utri main jaag pada to khvab hua
خامۂ در ریز سے ہیں اب گہر باری میں ہم,tabaddul yaan hai har saaat kabhi yuun hai kabhi vuun hai
نہ یہ معانی ام الکتاب سمجھے ہیں,qaza kahan se kahan le gai makinon ko
زینت دوش ترا نامۂ اعمال نہ ہو,tiri ankhon ko bhi inkar tiri zulf ko bhi
سیر کر اجڑے دلوں کی جو طبیعت ہے اداس,jauhar e ghuncha o gul men hai ik andaz e junun
تنہایی کے لمحوں میں کبھی رو بھی لیا کر,jo tiri zulf se utre hon mire angan men
عشق کو بھی روشنی درکار ہے,ik zara ahistagi darkar hai
یہ سہانی تری خوشبویے بدن کیا کہنا,zulf so mahki hui raton ka ban kya kahna
اب وہ گھر اک ویرانہ تھا بس ویرانہ زندہ تھا,yahan jo hai tanaffus hi men gum hai
خطا کسی کی ہو لیکن کھلی جو ان کی زباں,khata kisi ki ho lekin khuli jo un ki zaban
نہ فتوے کفر کے بدلے نہ عذر دار ہی بدلا,zeb e unvan e hadis e digaran banta gaya
سانسوں میں گھل رہی ہے کسی سانس کی مہک,kuchh na kuchh is daur men rang e chaman nikhra to hai
ہر شخص مرا ساتھ نبھا بھی نہیں سکتا,mere gham ko jo apna batate rahe
بھولی ہویی نہ ہو نگہ فتنہ گر مجھے,tum paas ho to kyuun nahin aate nazar mujhe
ہم رہروان راہ فنا دیر رہ چکے,aae hain 'mir' kafir ho kar khuda ke ghar men
بھرا ہے میے عشق سے جام دل کا,bhara hai mai e ishq se jaam dil ka
تھے آٹھ دس سو ہو گیے اب چھل کے چار پانچ,ye tamanna ek is saail ke dil men aur hai
تم کون سے تھے ایسے کھرے داد و ستد کے,bandha hai uqda e khatir se paiman khaksari ka
بدلتے جا رہے ہیں ہم بھی دنیا کو بدلنے میں,sitare jagte hain raat lat chhatkae soti hai
کہ ہے سر پنجۂ مژگان آہو پشت خار اپنا,mata e khana e zanjir juz sada maalum
ہزار فتنہ بیدار خواب رنگیں میں,is ada ka tiri javab nahin
غفلت بہ بال جوہر شمشیر پرفشاں,baagh pa kar khafaqani ye darata hai mujhe
تج دیا تم نے در یار بھی اکتا کے فرازؔ,taj diya tum ne dar e yar bhi ukta ke 'faraz'
تیری زلفیں جس کے بازو پر پریشاں ہو گییں,har ik makan ko hai makin se sharaf 'asad'
کچھ اتنا خوف کا مارا ہوا بھی پیار نہ ہو,magar pukarne vaala nazar nahin aata
اپنا نہیں یہ شیوہ کہ آرام سے بیٹھیں,yaan kya dhara hai qatra o mauj o habab men
اثر ہے جذب الفت میں تو کھنچ کر آ ہی جاییں گے,ye uthna baithna mahfil men un ka rang laega
زندگی بھر لہو رلایے گی,zindagi bhar lahu rulaegi
تھا حرم میں لیک نامحرم رہا,nachiz jante hain na bud jante hain
اب جھکوں گا تو ٹوٹ جاؤں گا,jo mujh ko zinda jala rahe hain vo be khabar hain
دل صد چاک بنایا تو بلا سے لیکن,kuchh kah nahin sakta huun zaban se ki zara dekh
یہ بات بات میں کیا نازکی نکلتی ہے,shab e firaq jo khole hain ham ne zakhm e jigar
چمکتا ہے برنگ مہر نورانی ہے یہ لڑکا,dekh lete hain ab us baam ko aate jaate
جھڑے پھول جس رنگ گلبن سے یوں,jama e ehram e zahid par na ja
تم مریض دانایی مصلحت کے شیدایی راہ گمرہاں کیا ہے تم نہ جان پاؤ گے,kitni der aur main rukun sahab
اکیلے غم سے نیی شاعری نہیں ہوتی,use sochna din dari lage
خار پا ہیں جوہر آیینۂ زانو مجھے,'asad' ye ijz o be samani e firaun e tauam hai
کن جتنوں سے میری غزلیں رات کا جوڑا کھولیں ہیں,hairat sara e ishq men din hai na raat hai
ہے اسدؔ بیگانۂ افسردگی اے بیکسی,har bul havas ne husn parasti shiar ki
کہ میرے ساتھ ہی مرتی ہے تیرے ہجر کی شام,sambhal kar ab havaon se ulajhna
اک بوسہ دیجیے مرا ایمان لیجیے,ik bosa dijiye mira iman lijiye
جو سلجھ جاتی ہے گتھی پھر سے الجھاتا ہوں میں,ya ye aalam apne saae se daba jaata huun main
رنگ کی اپنی بات ہے ورنہ,abhi zamir men thodi si jaan baaqi hai
کبھی خوش کر گیی مجھ کو تری یاد,gulabi hoti jaati hain fazaen
چلی ہے کیسی ہوا الہی کہ ہر طبیعت میں برہمی ہے,chali hai kaisi hava ilahi ki har tabiat men barhami hai
ہزار رنگ سے اپنی مجھے خبر آیی,kabhi ankhon men aansu aa gaya hai
نہ کر فکر خضاب اے شیخ تو پیری میں جانے دے,na dekha vo kahin jalva jo dekha khana e dil men
ہمارے سینے میں جو رہ گیی تھی آتش ہجر,fasana e shab e gham un ko ik kahani thi
کچھ سمجھ کر ہی خدا تجھ کو کہا ہے ورنہ,ham se divanon ke bin duniya sanvarti kis tarah
اب تک کے ترے ساتھ پہ حیرت بھی بہت تھی,vo ajab duniya ki sab khanjar ba kaf phirte hain aur
کرتی ہے عاجزی سفر سوختن تمام,aina dar ban gai hairat e naqsh e pa ki yuun
دونوں انساں ہیں تو کیوں اتنے حجابوں میں ملیں,donon insan hain to kyuun itne hijabon men milen
ہم کو مٹا سکے یہ زمانے میں دم نہیں,ik lafz e mohabbat ka adna ye fasana hai
ٹھہری ٹھہری سی نگاہوں میں یہ وحشت کی کرن,tu mohabbat ka sitara to javani ka suhag
نکال اے چارہ گر تو شوق سے لیکن سر پیکاں,tamanna hai ye dil men jab talak hai dam men dam apne
مجھے ہر کیفیت میں کیوں نہ سمجھے,so bikhar ke hi raha koi bikharne vaala
پھر شوق کر رہا ہے خریدار کی طلب,ai tira zulm sar ba sar andaz
زخمی ہیں محباں تری شمشیر جفا کے,mujh ko turshi ka hai parhez sanam
گنگنا کر آپ رو پڑتے ہیں جو,haath malne na hon piiri men agar hasrat se
تھی صعب عاشقی کی بدایت ہی میرؔ پر,nala e 'mir' savad men ham tak doshin shab se nahin aaya
جس کو بھی شیخ و شاہ نے حکم خدا دیا قرار,aap apne se ham sukhan rahna
پانی پانی کر گیی مجکو قلندر کی یہ بات,paani paani kar gai mujko qalandar ki ye baat
مرض میں مبتلا کر کے مریضوں کو دوا دینا,maraz men mubtala kar ke marizon ko dava dena
پھول بن کے سیروں میں اور کون شامل تھا,ret par naam likha karti hai
جاتے ہی میں وہاں سے ڈر آیا,dil nahin lag raha mohabbat men
وہ چھلاوا اس آن سے نکلا,sach to ye hai moamla dil ka
دور بیٹھا ہوا سر محفل,yahi to chashm e haqiqat nigar ka surma hai
آ اے بہار ناز کہ تیرے خرام سے,jab rishta be girah tha nakhun girah kusha tha
اس سے ہے غریبوں کو تسلی کہ اجل نے,kya puchhta hai ham se tu ai shokh sitamgar
اس کو بھولے برسوں گزرے لیکن آج نہ جانے کیوں,jhuut mashhur hua raaja ka sach ki sansar men shohrat na hui
وہ چال ایسی چل گیا ہم بجھ گیے دل جل گیا نکلے جلا کے اپنا گھر میں اور مری آوارگی,isi kyari men tha gulab koi
بھلا بھی دے اسے جو بات ہو گیی پیارے,bam o dar par hai musallat aaj bhi sham e alam
ہوا خاک اب یہ ہے انجام دل کا,hua khaak ab ye hai anjam dil ka
بہانے سے مجھے بھی ٹالتا ہے,barsa bhi to kis dasht ke be faiz badan par
شیر کو صید زبوں سے کیا غرض,na suna jaega ham se ye fasana hargiz
کافر نفس ہر ایک کا ترسا زر کوں پایا بختوں سیں,zamin pakdi hai tutiyon ne sunin jo mithi piya ki batiyan
چاہ سے آپ کو تو نفرت ہے,ab vo ye kah rahe hain miri maan jaiye
ہے تو گردش چرخ کی بھی فتنہ انگیزی میں طاق,ranj o taab musibat o gham yaas o dard o daagh
ہم تو بے نام ارادوں کے مسافر ہیں وسیمؔ,'vasim' ghar se ab aise men koi kya nikle
یہ عشق جان کو میرے کویی عذاب ہوا,mujhe to dekhte hi aur iztirab hua
اب اس سے بڑھ کے کیا ہو وراثت فقیر کی,abhi to khud se taqaze the ikhtisar ke bhi
پرندہ کیوں کسی شاخ شجر کا ہو جایے,kitna dushvar tha duniya ye hunar aana bhi
اور اگر مر جاییے تو نوحہ خواں کویی نہ ہو,is rang se uthai kal us ne 'asad' ki naash
اب رفتگاں کی بات نہیں کارواں کی ہے,ab raftagan ki baat nahin karvan ki hai
رگ سنگ سے ٹپکتا وہ لہو کہ پھر نہ تھمتا,kis raunat se vo kahte hain ki ham huur nahin
جس طرح سوکھے ہویے پھول کتابوں میں ملیں,jis tarah sukhe hue phuul kitabon men milen
ڈرتا ہوں جلوۂ رخ جاناں کو دیکھ کر,tuut padta hai dafatan jo ishq
صورت دود رہا سایہ گریزاں مجھ سے,na ho ba harzah bayaban navard e vahm e vajud
مطرب دل نے مرے تار نفس سے غالبؔ,ankhon ko rakh ke taaq pe dekha kare koi
میں بھی اسے کھونے کا ہنر سیکھ نہ پایا,to aaj aisi tiri saltanat nahin hoti
لوگ ہم سے خفا خفا سے رہے,khulus ka jo tha kabhi vo ab sila nahin raha
کاش کویی ہم سے بھی پوچھے,ba juz mere ye dukh bhi kis ne jhela main akela
تحریر حسن کی کچھ روداد کیا کرے گا,kya hi bigde ho patte ki baat par
برایی یا بھلایی گو ہے اپنے واسطے لیکن,ghanimat jaan jo dam guzre kaifiyat se gulshan men
ورنہ ہم رند تو بھڑ جاتے ہیں دو چار کے ساتھ,varna ham rind to bhid jaate hain do char ke saath
آزاد و گرفتار و تہی کیسہ و خورسند,azad o giraftar o tahi kiisa o khursand
وہ ماہتاب کبھی بام پر بھی آتا ہے,pahadiyon men ghire ye bujhe bujhe raste
ہمارے زایچے میں زندگی نکلتی ہے,kya ji laga ke sunte afsane aadmi hain
داغؔ کیوں تم کو بے وفا کہتا,bahut roya huun main jab se ye main ne khvab dekha hai
زخم پنہاں کی ہے نشانی بھی,aap ki itni mehrbani bhi
رنج و غم مانگے ہے اندوہ و بلا مانگے ہے,dil har ik haal se begana hua jaata hai
ہر ایک بات کو چپ چاپ کیوں سنا جایے,milne gae kisi se mil aae kisi se ham
تنگ آیے ہیں ہم ایسے خوشامد طلبوں سے,ijad karti hai use tere liye bahar
محتاجی کا خاصا ہے روباہ کرے ہے ببروں کو,zikr har subh o shaam hai tera
تیرے بن رات کے ہاتھوں پہ یہ تاروں کے ایاغ,zindagi jis ko tira pyaar mila vo jaane
اس طرف میں ہوں مرے گھر سے ادھر سناٹا,ujaad ban men utarta hai ek jugnu bhi
وہ ادایے دلبری ہو کہ نوایے عاشقانہ,main vo saaf hi na kah duun jo hai farq mujh men tujh men
میں نے ترے لحاظ میں تیرا کہا نہیں کیا,us gali men dukan kar li hai
ہم صدا دیں گے غم ہجر کے میناروں سے,rashk e khurshid e qayamat ye sharara nikla
جی کے زیاں کو عشق میں اس کے اپنا وارا جانے ہے,dard khincha hai nihayat ranj uthaya hai bahut
نیی زمین نیا آسماں بھی مل جایے,laila ne naya janam liya hai
یہ بھی اک تلخ حقیقت کے سوا کچھ بھی نہیں,har zamin mujh ko mire khuun se tar lagti hai
کسی کی آنکھ سے ٹپکا تھا اک امانت ہے,misal is ki kahan hai koi zamane men
کسے نہیں ہے تمنایے سروری لیکن,kise nahin hai tamanna e sarvari lekin
یہ کون لوگ اندھیروں کی بات کرتے ہیں,main janti thi paal rahi huun sanpoliye
حصار حسن کوں قایم کیا بانی ہے یہ لڑکا,aankh viran sahi phir bhi andheron ko 'nasir'
بوجھ اٹھاتے ہویے پھرتی ہے ہمارا اب تک,zamin le li magar asman chhod gaya
مریضان الفت کی کیا بے کسی ہے,kahan naqsh e avval kahan naqsh e sani
درد فرقت کی گو دوا ہے وصال,jis roz kuchh sharik hui meri musht e khak
جس کی جھنکار اتنی مدھم ہے,be dardiyan na puchhiye un se hayat ki
لے سانس بھی آہستہ کہ نازک ہے بہت کام,bas ai 'mir' mizhgan se ponchh ansuon ko
پھر تری چشم سخن سنج نے چھیڑی کویی بات,gham se chhut kar ye gham hai mujh ko
صفحۂ آینہ جولاں گہ طوطی نہ ہوا,hamza ka qissa hua ishq ka charcha na hua
مری سلطنت یہ ہی آشیاں مری ملکیت یہ ہی چار پر,jis rang men dekha tujhe yakta nazar aaya
پر ہم ایسے کھوے جاتے ہیں کہ وہ پا جایے ہے,is rahguzar men jalva e gul aage gard tha
ہوش و حواس و تاب و تواں داغؔ جا چکے,ranj kya vasl e adu ka jo taalluq hi nahin
دست گاہ دیدۂ خوں بار مجنوں دیکھنا,kyuun gardish e mudam se ghabra na jaae dil
پھر صبا سایۂ شاخ گل کے تلے,pahle bhi khizan men baagh ujde par yuun nahin jaise ab ke baras
ہو جاتا ہے ڈانوا ڈول کبھی,ruk kar apna hi intizar kiya
آفاق کی اس کارگہ شیشہ گری کا,tu kab tak ye moti pirota rahega
ادھر نکلے جگر سے تیر ادھر قالب سے دم نکلے,'zafar' munh se hamare naam us ka dam ba dam nikle
تو برگ نرگس اوپر بجا ہے لکھوں جو اپنے سجن کوں پتیاں,ham rahi ki baat mat kar imtihan ho jaega
اب بات بڑھ چکی ہے حیا کے مقام سے,mira kaha na suno un ki baat to sun lo
تنگ ظالم عرصۂ روز حساب آ جایے گا,hone ko tu ab dast o gareban hai maujud
سینہ روشن ہو تو ہے سوز سخن عین حیات,siina raushan ho to hai soz e sukhan ain e hayat
کہ مجھے تو خوش نہ آیا یہ طریق خانقاہی,ki mujhe to khush na aaya ye tariq e khanqahi
نہ دایم غم ہے نے عشرت کبھی یوں ہے کبھی ووں ہے,dil azari ne teri kar diya bilkul mujhe be dil
بلا سے آج اگر دن کو ابر و باد نہیں,khisht pusht e dast e ijz o qalib aghosh e vidaa
ہے ناز مفلساں زر از دست رفتہ پر,kyuun radd e qadah kare hai zahid
شب کٹ گیی فرقت کی دیکھا نہ فراقؔ آخر,kade hain kos bahut manzil e mohabbat ke
ہندوی ہر دوار باسی ہے,ai 'vali' aab us pari ru ki
سو آ گیا ہے تمہارا خیال ویسے ہی,so aa gaya hai tumhara khayal vaise hi
وہ بے سبب یوں ہی روٹھا ہے لمحہ بھر کے لیے,bachchon ko apni bhiik ke pyale to de gaya
قفس اداس ہے یارو صبا سے کچھ تو کہو,milta hai khiraj us ko tiri nan e javin se
داغؔ سے کہہ دو اب نہ گھبراؤ,arsa e hashr men vo aa pahunche
منزل منزل راہ گزر,laut chalen ab apne ghar
ہم سے یہ فیصلہ نہیں ہوتا,kahin na khatir e masum par giran guzre
خوب پردہ ہے کہ چلمن سے لگے بیٹھے ہیں,fitna gar kya makan se nikla
یوں تو اس دور میں بے کیف سی ہے بزم حیات,raat bhar husn par aae bhi gae sau sau rang
ذرا سی کم تو ہویی ہے یہ تیرگی دیکھو,kyuun purana hua viran zara dekh to lo
کویی چھپ سکتی ہے جو صورت ہو پہچانی ہویی,na rasai ajab rasai hai
اس کی آنکھیں ترے چہرے پہ بہت بولتی ہیں,use ganva ke ajab hausle talash karun
باد یک عمر ورع بار تو دیتا بارے,vo jo rakhte the ham ik hasrat e tamir so hai
حالت حال کے سبب حالت حال ہی گیی,kahni hai mujh ko ek baat aap se yaani aap se
تو کہے جنس ناروا ہے عشق,achchha nahin chehre par lohu ka baha jaana
وہ مسیحا نفس نہیں جس کا,ya hasin dhundlakon men phuul hain baharon ke
اب شوق کا کچھ اور ہی عالم ہے مری جاں,barham jo hui bazm e tarab is ka gila hai
بزم ساقی میں ادب آداب مت دیکھا کرو,bazm e saqi men adab adab mat dekha karo
دل میں نظر آتی تو ہے اک بوند لہو کی,junun tohmat kash e taskin na ho gar shadmani ki
تیری مرضی کے مطابق نظر آییں کیسے,be sahara tha bahut pyaar koi puchhta kya
آج ہر قطرۂ مے بن گیا اک چنگاری,parda e arz e vafa men bhi raha huun karta
اور ہم بھول گیے ہوں تجھے ایسا بھی نہیں,hai tira dost magar aadmi achchha bhi nahin
اس آہ سرد اور اس چشم تر سے کچھ نہ ہوا,laash bhi meri pai e tashhir phir khinchi to kya
کچھ سراسیمگی عشق کا اقرار تو ہے,ishq ke sar ta abad ilzam hi ilzam tha
سنا کرو مری جاں ان سے ان سے افسانے,ban jaenge zahr piite piite
ہمیں معلوم ہے ہم سے سنو محشر میں کیا ہوگا,samajhta kya hai tu divangan e ishq ko zahid
ہستی مری سیراب ہے آنکھوں کی نمی سے,kuchh hosh men aa jaae miri be khabari se
مینایے مے ہے آبلہ پایے نگاہ کا,jo tum se shahr men hon ek do to kyunkar ho
تری آنکھ پھرتے ہی کیسا پھرا ہے,chahiye paigham bar donon taraf
یاں تک عدو کا پاس ہے ان کو کہ بزم میں,ishq ne jin ko kiya khatir girafta un ka dil
یہ مثل پوری یہاں من مانی گھر جانی ہویی,mangna sakht be hayai hai
آخری خط میں یہ لکھا تھا فقط آپ کی دوست,akhiri khat men ye likkha tha faqat aap ki dost
دھوپ اور چھاؤں بانٹ کے تم نے آنگن میں دیوار چنی,jab se vo ahl e siyasat men hue hain shamil
ہم بھی اب آزاد ہیں یارو ابھی یہ مت کہو,har divane ko kahan jama dari aave hai
صفایی ہے باغ محبت میں ایسی,ham ko chhedoge to pachhtaoge
زلفوں میں الجھ آتے ہیں شامت ہے تو یہ ہے,zulfon men ulajh aate hain shamat hai to ye hai
ڈر ہے نہ بھول جایے وہ سفاک روز حشر,ye jaan tum na loge agar aap jaegi
ہر جگہ ڈھونڈھتا پھرتا ہے مجھے گھر میرا,kahani men to kirdaron ko jo chahe bana diije
نہ پوچھ بے خودی عیش مقدم سیلاب,vaqt hai gar bulbul e miskin zulekhai kare
کہ خاک راہ کو میں نے بتایا راز الوندی,ki khak e rah ko main ne bataya raz e alvandi
نگاہ و دل کو قرار کیسا نشاط و غم میں کمی کہاں کی,ham ahl e qafas tanha bhi nahin har roz nasim e subh e vatan
عمر بھر کس کس کے حصے کا سفر میں نے کیا,main us ka ho nahin sakta bata na dena use
اس کا ہے جو بھی کچھ ہے مرا اور میں مگر,vo sunni bachcha kaun tha jis ki jafa ne 'jaun'
یہ دل کے پار ہو کر پھر دل کو ڈھونڈتے ہیں,abhi paida hue the ranj o rahat to amaan ho kar
کیا فایدہ ہے دعویے عشق حسین سے,dil ki galiyan badi sunsan hain aae koi
کب کسی در کی جبہہ سایی کی,tevar tire ai rashk e qamar dekh rahe hain
جور فلک کی داستاں ایسی بھی مختصر نہیں,manind e gard bad huun khana ba dosh main
خاطر سے یا لحاظ سے میں مان تو گیا,hosh o havas o taab o tavan 'dagh' ja chuke
تم سر بہ سر خوشی تھے مگر غم ملے تمہیں,sharminda hain ki us men bahut kham mile tumhen
مزاج ان کا نہیں ملتا ہمارا دل نہیں ملتا,mizaj un ka nahin milta hamara dil nahin milta
بھویں تنتی ہیں خنجر ہاتھ میں ہے تن کے بیٹھے ہیں,khade hon zer e tuba vo na dam lene ko dam bhar bhi
اس قدر دشمن ارباب وفا ہو جانا,yaas o ummid ne yak arbada maidan manga
اب زمانہ نہیں کہ تجھ سے کہیں,ab zamana nahin ki tujh se kahen
ظاہرا غمگیں اسے رہنا خوش آیا ہے بہت,us rind ki bhi raat guzar gai jo uur tha
میری نگاہ شوق بھی کچھ کم نہیں مگر,kyuun mast e sharab e aish o tarab taklif e tavajjoh farmaen
نہ آیی سطوت قاتل بھی مانع میرے نالوں کو,rishta e har shama khar e kisvat e fanus tha
سانس لیتے ہویے بھی ڈرتا ہوں,saans lete hue bhi darta huun
جن جن کو تھا یہ عشق کا آزار مر گیے,ghabra na 'mir' ishq men us sahal e zist par
اپنی محرومیاں چھپاتے ہیں,yuun jo takta hai asman ko tu
جوں پر طاؤس جوہر تختہ مشق رنگ ہے,mushkil ki tujh se rah e sukhan va kare koi
کل تو شاید ناول لکھے جاییں ان رومانوں پر,kuchh na kuchh raah pe le aae hain
ناداں جسے کہتے ہیں تقدیر کا زندانی,nadan jise kahte hain taqdir ka zindani
میں عدم سے بھی پرے ہوں ورنہ غافل بارہا,shama ruyan ki sar angusht e hinai dekh kar
جس کسی کو کہیں ہوا ہے عشق,is dasht men sar gaade juun sail chala jaana
ایک جا حرف وفا لکھا تھا سو بھی مٹ گیا,mai khana e jigar men yahan khaak bhi nahin
کسی کو اپنے مطابق کویی بنا نہ سکے,koi bhi dastak kare aahat ho ya avaz de
دل دھڑکتے ہی پھر گیی وہ نظر,haan maze luut le javani ke
جب تک تھا آسمان میں سورج سبھی کا تھا,har khel ka maidan yahan bhi hai vahan bhi
گلابی ہوتی جاتی ہیں فضاییں,ek muddat se tiri yaad bhi aai na hamen
جو دل لے کر کہے کم بخت تو کس دل سے ملتا ہے,ye na kahiye ki muddaa kahiye
ایسے قاتل کا کیا کرے کویی,ham koi tark e vafa karte hain
اب خواب ہے نے آرزو ارمان ہے نے جستجو یوں بھی چلو خوش ہیں مگر میں اور مری آوارگی,roya pi kar bahut sharab koi
جس طرح کا کہ کسی میں ہو کمال اچھا ہے,huun main bhi tamashai e nairang e tamanna
دل ہی تو ہے سیاست درباں سے ڈر گیا,umr e aziz sarf e ibadat hi kyuun na ho
کف افسوس ملنا عہد تجدید تمنا ہے,ik nau bahar e naz ko taake hai phir nigah
چمن میں ناز بلبل نے کیا جو اپنی نالے پر,sun ke mira fasana unhen lutf aa gaya
اللہ کے بندوں نے لیکن اس راہ میں چلنا چھوڑ دیا,allah ke bandon ne lekin us raah men chalna chhod diya
فیضؔ نہ ہم یوسفؔ نہ کویی یعقوبؔ جو ہم کو یاد کرے,aate aate yunhi dam bhar ko ruki hogi bahar
کہانی میں تو کرداروں کو جو چاہے بنا دیجے,us ki phati qamis mire saath ho gai
مگر افسوس اب وہ جی ہی نہیں,magar afsos ab vo ji hi nahin
ہوں داغ نیم رنگی شام وصال یار,dekh ke meri be khudi chalne lagi hava ki yuun
غم سے مرتا ہوں کہ اتنا نہیں دنیا میں کویی,nae fitnon men ab charkh e kuhan ki azmaish hai
ہوا تجھ عشق سوں اے آتشیں رو دل مرا پانی,yak baar use mohan chhati suun lagati ja
اسے بھی کیسے کر گزریں جو دل میں ٹھان لیتے ہیں,tira ai maut ham ye dusra ehsan lete hain
کشادہ دست کرم جب وہ بے نیاز کرے,kushada dast e karam jab vo be niyaz kare
کیا خطا کی جو کہا میں نے نہ مانا تیرا,tu badal daal hua naam purana tera
جب نہ تب جاگہ سے تم جایا کیے,girya nikale hai teri bazm se mujh ko
وعدے کیے کسی سے گزاری کسی کے ساتھ,ham ko mahsus kiya jaae hai khushbu ki tarah
تلخی مے کو تیز تر کر دے,ye khun e shahidan hai ki zar khana e jam hai
کبھی سیدھے تمہارے گیسویے پر خم بھی ہوتے ہیں,hal e dil bhi suna ke dekh liya
غیر لیں محفل میں بوسے جام کے,khulega kis tarah mazmun mire maktub ka ya rab
میں کیسے بات کروں اب کہاں سے لاؤں اسے,main kaise baat karun ab kahan se laun use
زنداں میں اپنے ساتھ رلاییں کسی کو کیا,akhir tum men kya jaadu hai kyuun man men bas jaate ho
کچھ سخن تو زباں کے تھے ہی نہیں,vo angdai mere kamre tak to badi ruhani thi
انہی پہ ہو کبھی نازل عذاب آگ اجل,ghaur karte naiin hunar ki taraf
ہر ذرے کو گواہ کیے جا رہا ہوں میں,kyuun aa gai aise men tiri laghzish e pa yaad
بلبل گل تصویر کا شیدا نہیں ہوتا,bulbul gul e tasvir ka shaida nahin hota
