urdu_text,roman_text
دیکھیں دل کا شکار کون کرے,gar maze ka gila kare koi
پھر بھی اس کوچے سے گزرے پھر بھی اس کا نام لیا ہے,phir bhi us kuche se guzre phir bhi us ka naam liya hai
مجھ کو وہ میرے نام سے پہچان تو گیا,rang laaya hai ye lakhe ka jamana tera
یہی ایک دن کام کر جایے گی,bu nahin aati ashnai ki
دل دار و دل فریب دل آزار و دل ستاں,bastiyon se yahi avaz chali aati hai
بال کشادہ ہے نگۂ آشنا مجھے,har chand subuk dast hue but shikani men
میں ہوں کہ کویی اور ہے دنیا ہے کہ تم ہو,main huun ki koi aur hai duniya hai ki tum ho
کیا حال ہے کیا دکھا رہے ہو,lekin saval ye hai ki dar o rasan ke baad
یہ زن نغمہ گر و عشق شعار,kabhi dhanak si utarti thi un nigahon men
کس غضب کا سنگھار کر بیٹھے,jahan e hadsa agin men bashar ka varud
ساحل پہ سمندروں سے بچ کر,baali ki tarah latak raha hai
کب سے نامہربان ہے پیارے,na mukammal se istiare hain
اپنے جوہر کی حیا سوں سر بسر پانی ہوا,gaahe ai isvi dam yak baat lutf suun kar
کیسے کہہ دوں کہ مجھے چھوڑ دیا ہے اس نے,itna sahma sahma chand
ازل ہو یا ابد دونوں اسیر زلف حضرت ہیں,ishq ka sehr kamyab hua
طلوع صبح سے پہلے ہی بجھ نہ جاییں کہیں,muft men ham avara thahre muft men ghar viran hua
احکام ترے حق ہیں مگر اپنے مفسر,ahkam tire haq hain magar apne mufassir
واعظ نہیں کیفیت مے خانہ سے آگاہ,ab e hayat ki si saari ravish hai us ki
آیے تاریخ عشق میں سو بار,sar se pa tak supurdagi ki ada
مگر افسوس یہ سچ ہے وہ شب تھی اور یہ سورج ہے یہ سب کو مان جانے میں ابھی کچھ دن لگیں گے,hosh jab be khudi se milta hai
وہ گراں خواب جو ہے ناز کا اپنے سو ہے,mua kohkan be sutun khod kar
اے مرگ ناگہاں تجھے کیا انتظار ہے,takalluf khar khar e iltimas e be qarari hai
رحمان کی رحمت ہو کہ بھگوان کی مورت,jab tak sanson ka bandhan hai jiite jaao socho mat
ٹوٹ جاتی ہے وہ ہمت مجھے معلوم نہ تھا,mit gaya teri badaulat mujhe maalum na tha
ہوا کی راہ میں یہ شمع جل تو سکتی ہے,ki girte girte bhi duniya sambhal to sakti hai
پاگل ہویے جاتے ہو فرازؔ اس سے ملے کیا,pagal hue jaate ho 'faraz' us se mile kya
مگر یہی مصلحت مرے دل کو کھل رہی ہے,lekin ek safar par ai dil ab jaana to hoga
کن انکھیوں سے اس کو مگر دیکھ لینا,koi dil dikhae agar dekh lena
پتھروں میں بھی کبھی آینے جڑ جاتی ہیں,koi to habs e hava se ye puchhta 'mohsin'
قاضی شہر کچھ اس باب میں ارشاد کرے,bakht se koi shikayat hai na aflak se hai
آج دروازوں پہ دستک جانی پہچانی سی ہے,chand ke dubne ki baat usi shaam ki thi
سب رقیبوں سے ہوں نا خوش پر زنان مصر سے,ab tak vo janta hai ki mere hi paas hai
فقط اک میرا نام تھا میرا,ye mira taur e zindagi hi nahin
صبح کی طرح جھمکتا ہے شب غم کا افق,kabhi to subh tire kunj e lab se ho aghaz
بے طرح حال دل ہے اور تجھ سے,be tarah hal e dil hai aur tujh se
درد کا حد سے گزرنا ہے دوا ہو جانا,ashna 'ghalib' nahin hain dard e dil ke ashna
کویی جلدی میں کویی دیر سے جانے والا,chup chup makan raste gum sum nidhal vaqt
کیوں سب طرف راہ گزر دیکھ رہے ہیں,akhbar ka parcha hai khabar dekh rahe hain
تیرے کہنے میں رہا کرتی ہے,ham se agar hai tark e taalluq to kya hua
پھر یہ کیا ہے اگر مزاج نہیں,garche zahir men takht o taj nahin
تجھ قد کوں دیکھ بولے یو ناز ہے سراپا,andhera zehn ka samt e safar jab khone lagta hai
کر مجھے قتل وہاں اب کہ نہ ہو کویی جہاں,kiya jo qatl mujhe tum ne khuub kaam kiya
آیینوں کو زنگ لگا,kya tum ko is haal men bhi
ہے عجب فیصلے کا صحرا بھی,shayad vo din pahla din tha palken bojhal hone ka
کچھ بھی میری زبان سے نکلا,jo hamari zaban se nikla
ترے ہاتھوں میں لٹتا جا رہا ہوں,tujhe kuchh bhulta sa ja raha huun
یہ قرب کیا ہے کہ یک جاں ہویے نہ دور رہے,ye qurb kya hai ki yak jan hue na duur rahe
میں بستر خیال پہ لیٹا ہوں اس کے پاس,akhir hain kaun log jo bakhshe hi jaenge
طاقت بقدر لذت آزار بھی نہیں,ya ilahi ye majra kya hai
نہ دیکھا وہ کہیں جلوہ جو دیکھا خانۂ دل میں,na kar zalim dil azari jo ye dil manzur hai lena
جو بھلا تھا اسی کو بھول گیا,ye kahani nahin sunani hai
کچھ ان کی دسترس کا پتا کر چکے ہیں ہم,un ko apna bana ke dekh liya
دفن ہو جاییں کہ زرخیز زمیں لگتی ہے,zindagi yuun hui basar tanha
جس دل میں ہو جتنا خون لایے,hain meri pyaas ke phunke hue ye virane
کتنی دل کش ہو تم کتنا دلجو ہوں میں,hijr ho ya visal ho kuchh ho
جہاں جہاں سے بہاروں کے کارواں نکلے,ai aarzu ke dhundle kharabo javab do
کہیں آہ بن کے لب پر ترا نام آ نہ جایے,sham e gham ke sulagte sahra men
دیکھیے آج فقیروں کا کدھر پھیرا ہے,raat bhar hijr ki lazzat se maza luuta hai
سرمے سے تیز دشنۂ مژگاں کیے ہویے,mohabbat thi chaman se lekin ab ye be dimaghi hai
تو کیا چھپا کہ مجھ کو مجھی سے چھپا دیا,jaari hue sar chashme miri tishna labi se
کویی بتایے میں مر چکا ہوں کہ جی رہا ہوں,bhadkaen miri pyaas ko aksar tiri ankhen
لے چلو مجھ کو راہروان عدم,khushi men ham ne ye shokhi kabhi nahin dekhi
وہ نازک بدن پاؤں بھاری لگے,us ka qusur ye tha bahut sochta tha vo
دشمنی اپنی تھی میری دوست داری ہایے ہایے,ek dil tis par ye na ummid vari haae haae
کس کی نمود کے لیے شام و سحر ہیں گرم سیر,kis ki numud ke liye shaam o sahar hain garm e sair
طلب میں ہوں تمنا کی قسم ہے,hakim e vaqt hai tujh ghar men raqib e bad khu
دل ان کا ہر اک طور سے بہلا تو گیے ہم,jaane kis ka naam khuda tha pital ke gul danon par
مجھ کو دیوانوں میں لیکن کویی تجھ سا نہ ملا,mujh ko divanon men lekin koi tujh sa na mila
غالبؔ گر اس سفر میں مجھے ساتھ لے چلیں,sharab khane ke divar o dar men khaak nahin
ہنس کے کرتا ہے بیان شوخی گفتار دوست,naqsh e pa jo kaan men rakhta hai ungli jaada se
یہ بندگی خدایی وہ بندگی گدایی,ye bandagi khudai vo bandagi gadai
وہ شخص کویی فیصلہ کر بھی نہیں جاتا,vo shakhs koi faisla kar bhi nahin jaata
لیکن یہ کیا کہ شہر ترا چھوڑ جاییں ہم,abad kab hue the ki barbad ham hue
مجھ کو تیری دوستی درکار ہے,nigah e yar tujh ko kya bataen kya samajhte hain
شہر سے باہر کی ویرانی بسانا تھی مجھے,abr ki zad men sitara nahin dekha jaata
قتل چھپتے تھے کبھی سنگ کی دیوار کے بیچ,shua e subh ki surat utar bhi aata hai
سیپی میں بن نہ پایے گہر تم کو اس سے کیا,tere milne ki khushi men koi naghma chhedun
وہ تیغ مل گیی جس سے ہوا ہے قتل مرا,hai aaj zamin ka ghusl e sehhat
تیری خوش قامتی سے ملتا ہے,kaash pahlu men dhadakta hi rahe dil mera
خود تراشیدہ اصولوں پہ بھی اڑ جاتے ہیں,hayat ab sham e gham ki tashbih khud banegi
کو بہ کو پھیل گیی بات شناسایی کی,raat hui aur nikla chand
نشان ساحل الفت ملا ملا نہ ملا,malamaton men kahan saans le sakenge vo log
حرف تازہ نیی خوشبو میں لکھا چاہتا ہے,bahane se mujhe bhi talta hai
ذرہ بے پرتو خورشید نہیں,shama se hai bazm e angusht e tahayyur dar dahan
وقت غروب آج کرامات ہو گیی,javani ki doshizgi ka tabassum
ایک لگن کی بات ہے جیون ایک لگن ہی جیون ہے,kabhi jamhuriyat yahan aae
فضا کا حبس شگوفوں کو باس کیا دے گا,main apni be khabari se magar halak hua
بہت رویے ہم اس کی رخصت کے بعد,so us ki tegh ne jhagda hi infisal kiya
نشہ ہا شاداب رنگ و ساز ہا مست طرب,kya bane baat jahan baat banae na bane
جنگل کی ہوا رہوں کہاں تک,tahrir usi ki hai magar dil
یہی کہ سب کی کمانیں ہمیں پہ ٹوٹی ہیں,vo khud ko dhundne ke havale to de gaya
نہ جانے کب سے یہاں وقت ٹل رہا ہے میاں,jis ke kuche men baraste rahe patthar mujh par
اس توقع پہ کہ خود سے بھی جدا ہو جاؤں,har aarzu miri ankhon ki raushni thahri
اور کیا تھا اس کی پرسش کا جواب,kahan jaata agar main laut ke phir ghar nahin jaata
گو اپنے ہزار نام رکھ لوں,main sham e sahar ka naghma gar tha
ہم ان کو بھولنے والے نہیں ہیں,vo jo manzilon pe la kar kisi ham safar ko luten
لذت غم کے سوا تیری نگاہوں کے بغیر,ki main to khud apne ghar men bhi do ghadi raha huun
ہایے وہ شدت انتظار نہ پوچھ,jab sitare hi nahin mil paae
نہیں رونے میں گر ظفرؔ تاثیر,vo sau sau atkhaton se ghar se bahar do qadam nikle
تیغ ادا نہیں ہے پابند بے نیامی,parvaz ha niyaz e tamasha e husn e dost
جب بنام دل گواہی سر کی مانگی جایے گی,mangne vaale ki hajat nahin dekhi jaati
نہیں اب جہان میں دوستی کبھی راستے میں جو مل گیے,suna hava ko padha nadi ko mausam ko ustad kiya
اک غزل ہے کہ ہو رہی ہے ابھی,ik ghazal hai ki ho rahi hai abhi
ہم کویی ترک وفا کرتے ہیں,bavar aaya hamen paani ka hava ho jaana
کھینچے گا کون پھر یہ ترے ناز میرے بعد,shaikh mai khane se bhala khiska
فلک نے آہ تری رہ میں ہم کو پیدا کر,khana e dil se zinhar na ja
دیکھوں یہ کسی اور کا چہرہ ہے کہ تم ہو,dekhun ye kisi aur ka chehra hai ki tum ho
آباد کرتے آخر ویرانے آدمی ہیں,jis pe insan ka guzarta hai guman
اب ہے بس اپنا سامنا در پیش,so gai hogi vo shafaq andam
میں اس کا آیینہ ہوں وہ ہے میرا آیینہ,zahid ne kuchh is andaz se pi saaqi ki nigahen padne lagin
ٹھہرا نہ دل کہیں بھی تری انجمن کے بعد,is zaban dani par aise be zaban paida hue
وہ شب درد و سوز و غم کہتے ہیں زندگی جسے,vo shab e dard o soz o gham kahte hain zindagi jise
بڑا مزہ ہو اگر تھوڑی دور ساتھ چلو,bada maza ho agar thodi duur saath chalo
اپنے گھر کے در و دیوار سجا کر دیکھو,phir murat se bahar aa kar charon or bikhar ja
بھولے سے مسکرا تو دیے تھے وہ آج فیضؔ,galiyon men phira karte the do chaar divane
کیا سمجھتے ہو کہ خالی جایے گی,kya samajhte ho ki khali jaegi
اور پھر بھی میں شریک ترے قہقہوں میں ہوں,aur phir bhi main sharik tire qahqahon men huun
یاد آ گیا مجھے تری دیوار دیکھ کر,gharib e sitam didah e baz gashtan
لگتا ہے اندھیرے میں سویرے کی کرن تو,raat hamen kuchh yaad nahin tha
ہر شکست قیمت دل میں صداۓ خندہ ہے,lekin tire khayal se ghafil nahin raha
کٹ مرے اپنے قبیلے کی حفاظت کے لیے,kat mare apne qabile ki hifazat ke liye
اپنا زمانہ آپ بناتے ہیں اہل دل,ye misraa kaash naqsh e har dar o divar ho jaae
رات دن گردش میں ہیں سات آسماں,jo lafz ki 'ghalib' mire ashar men aave
کب سے نہیں ہوا ہے کویی شعر کام کا,sham e mah o nujum gul kar ke
رفتار سایہ کو ہے پست و بلند یکساں,jama hain ik ja vatan avargan e lucknow
کذب کیسے ہو تصوف میں نہاں,ai zahir o maujud mira jism dua hai
کرنا ہے آج حضرت ناصح سے سامنا,ab to ye bhi nahin raha ehsas
اس گلی میں مری چلی ہی نہیں,farq aaya na yak sar e mu bhi
ہم یہ تو نہیں کہتے کہ غم کہہ نہیں سکتے,jo ham pe shab e hijr men us mah e laqa ke
کر نہ دنیا کا تردد کار دنیا سہل ہے,ankhon ke ru ba ru se tu logon ke tal ke chal
یہ راحت ہویی ایسی محنت کے بعد,lohu paani ek kare ye ishq e lala azaran hai
انیسؔ یوں ہوا حال جوانی و پیری,hasil hai kya sivae tarai ke dahr men
داد دیتا ہے مرے زخم جگر کی واہ واہ,muddat hui ki ashti e chashm o gosh hai
میں زندہ ہوں تو اس زندہ ضمیری کی بدولت ہی,jahan charagh hamen rasta dikha na sake
مجھے ہے سوچ یہ ہی کس طرح حساب ہوا,fursat na use misl e charagh e sahari di
بٹے رہو گے تو اپنا یوں ہی بہے گا لہو,tiri nigah e pasheman ko kaise dekhunga
صبح چمن میں اس کو کہیں تکلیف ہوا لے آیی تھی,burqa uthte hi chand sa nikla
من کی دولت ہاتھ آتی ہے تو پھر جاتی نہیں,man ki daulat haath aati hai to phir jaati nahin
ہاتھ آ کر لگا گیا کویی,itna to zindagi men kisi ke khalal pade
کویی تجھ سا ہو تو پھر نام بھی تجھ سا رکھے,koi tujh sa ho to phir naam bhi tujh sa rakkhe
اب کسی بات پر نہیں آتی,kya bad guman hai mujh se ki aine men mire
بہ سیل اشک لخت دل ہے دامن گیر مژگاں کا,aaina zanu e fikr e ikhtira e jalva hai
روتی آنکھ کو پیار کہاں سمجھانے دے,pahuncha hai buzurgon ke bayanon se jo ham tak
جو غیر تھے وہ اسی بات پر ہمارے ہویے,jo ghair the vo isi baat par hamare hue
اس بستی سے چھٹ کر یوں تو ہر چہرہ کو یاد کیا,dosti ki to nibhai na gai dushmani men bhi adavat na hui
کہیں کیا جو پوچھے کویی ہم سے میرؔ,mere rone ki haqiqat jis men thi
میری آنکھوں سے کہیں کھو گیا منظر میرا,kahin to koi hoga jis ko apni bhi zarurat ho
زندگی تجھ کو بھلایا ہے بہت دن ہم نے,zindagi ek khalish de ke na rah ja mujh ko
ملامتوں میں کہاں سانس لے سکیں گے وہ لوگ,kaun hoga jo mujhe us ki tarah yaad kare
ہم سے اگر ہے ترک تعلق تو کیا ہوا,ye kam ho to ab khun e vafa saath liye ja
ہر چند مری جان کو تھا ربط لبوں سے,tere hi jalve ka hai ye dhoka ki aaj tak
آیینے کو ناز تھا کیا اپنے رویے صاف پر,ho jo us chashm e mast se be khud
پر گل خیال زخم سے دامن نگاہ کا,haya hai aur yahi gu magu to kyunkar ho
کسی بھی جگ میں کویی دیوتا بھی کیا ہوگا,mazlumon majburon ka gham ye jo mire sheron men dhala hai
اب یہاں ہوش میں کبھی اپنے,ishq ko darmiyan na laao ki main
تم نہ آؤ گے تو مرنے کی ہیں سو تدبیریں,hina e panja e saiyyad murgh e rishta bar pa hai
اے مرے شہر نگاراں ترا کیا حال ہوا,haae us vaqt ko kosun ki dua duun yaaro
ہوتی ہے دلبروں کی عنایت کبھی کبھی,ye bhog bhi ek tapasya hai tum tyaag ke maare kya jaano
رلاتی ہے مجھے راتوں کو خاموشی ستاروں کی,rulati hai mujhe raton ko khamoshi sitaron ki
لیکن مری آنکھوں میں تجھے ڈر نہ ملے گا,nae makan banae to faslon ki tarah
ذروں کو آفتاب بناتا رہا ہوں میں,ki yahan sab ke sar gaya huun main
اس آینے کو کویی عکس اب نیا دوں گا,kul yaum e hijr zard zamanon ka yaum hai
نہیں ذریعۂ راحت جراحت پیکاں,ki ek umr se hasrat parast e balin hai
سنا ہے ٹھکانے کے دن آ رہے ہیں,kuchh un ki dastaras ka pata kar chuke hain ham
سزا بھی پایی نہیں اور معاف بھی نہ ہوا,apni tanhai mire naam pe abad kare
ان چراغوں کو ہواؤں سے بچایا جایے,dhuup men niklo ghataon men naha kar dekho
دور افتادہ بستیوں میں کہیں,asmanon ki khair ho yarab
بہت وسعت ہے میری داستاں میں,varna ham aur kisi shai ke talabgar nahin
کریں گے قصد ہم جس دم تمہارے گھر میں آویں گے,khvah kar insaf zalim khvah kar bedad tu
آسماں بھر گیا ہے چیلوں سے,ik aise dard ki tum ko shuaen bheji hain
حالیؔ دل انساں میں ہے گم دولت کونین,khush hai ummid e khuld par 'hali'
اپنی ہی صدا سنوں کہاں تک,vo meri sada jhatak raha hai
سر شام سے تا سحر قرب جاناں,vo jin ke haal men lau de uthe gham e farda
گیی عمر در بند فکر غزل,us ke lab se talkh ham sunte rahe
مجھ سے ہی ہے ہر ایک سیاست کا اعتبار,ye hansi bhiig ke kuchh aur chamak jaegi
ترے ماتھے ترے بستر کی شکن بھی اب کے,vo ham safar tha magar us se ham navai na thi
ہوں دام میں پر افشاں اور سادگی سے حیراں,ho gae bedar kyuun kaisi kahi
سنورا نہیں جہاں,daman ko chhu raha hai koi haat kya karen
آپ سے تم تم سے تو ہونے لگی,vo to dam de ke jaan lete hain
تپش سے میری وقف کشمکش ہر تار بستر ہے,lab e qadah pe kaf e bada josh e tishna labi hai
یہ دہشت کا سفر جنگل یہ بیلہ میں اکیلا,raat jal thal miri ankhon men utar aaya tha
دیکھتے ہیں چشم از خواب عدم نکشادہ سے,tumhare aaiyo ai turrah ha e kham ba kham aage
مسافرو شب اول بہت ہے تیرہ و تار,vo gul huun juda sab se hai jis ka rang
حسن سوز نہاں مجسم ہے,zindagi zindagi ka matam hai
یہ کہہ سکتے ہو ہم دل میں نہیں ہیں پر یہ بتلاؤ,kuchh hamari khabar nahin aati
نشہ ہے راہ کی دوری کا کہ ہم راہ ہے تو,tum bano rang tum bano khushbu
وہ رکھ رکھاؤ ابھی میرے کج کلاہ میں ہے,jo gham mila hai bojh uthaya hai us ka khud
اب کے کچھ ایسی سجی محفل یاراں جاناں,ab ke kuchh aisi saji mahfil e yaran janan
جسم میں جب تک حرارت ہے چلو یوں ہی سہی,chidiyon ki chahkar men gunje radha mohan ali ali
کہ منزل پہ ہیں اور چلے جا رہے ہیں,nigah nichi kiye sar jhuka ke luut liya
دل جو دیا تھا سو تو دیا سر جدا دیا,par kuchh kaha gaya na gham e dil haya se aaj
کیا ہم اس بد گماں سے بات کریں,dil pareshan hua jaata hai
میں تیری بزم سے جب ناامید اٹھا تھا,usi ki nikhat e barbad ka zamana tha
کہ خودی کے عارفوں کا ہے مقام پادشاہی,ki khudi ke arifon ka hai maqam padshahi
کیوں رہے میری دعا منت کش بال ملک,jaan tujh par nisar kar baithe
خرمن جلے اگر نہ ملخ کھایے کشت کو,sambhalne de mujhe ai na ummidi kya qayamat hai
سب پہ روشن ہے ہماری سوزش دل بزم میں,mohabbat chahiye baham hamen bhi ho tumhen bhi ho
آخر مرے مزاج میں کیوں دخل دے کویی,dekhne vaale haath malte hain
تمہارا جو فیصلہ رہا تھا,na samajhne ka use vaqt na samjhane ka
افشاں غبار سرمہ سے فرد صدا کروں,ik khun chakan kafan men karodon banao hain
رخنوں سے دیوار چمن کے منہ کو لے ہے چھپا یعنی,hangama garm kun jo dil e na subur tha
نہ ملا کویی غارت ایماں,tha na juz gham bisat e ashiq men
سنتے ہیں لیلی کے خیمے کو سیاہ,surat pazir ham bin hargiz nahin ve maane
جب تک کہ مے ہے شیشہ میں پیمانہ ساتھ ہے,mire sabr o tab ke samne na hujum e khauf o raja raha
دل مت لگا رخ عرق آلود یار سے,ham saya e mughan men muddat se huun chunanche
وطن کی سر زمیں میں بھوک سے کہرام ہے ساقی,ai ruh e asr jaag kahan so rahi hai tu
نہ تھی طاقت مجھے آنے کی لیکن,har taraf suun mujhe kashakash hai
وہ میرے اشک بجھایے گا کس طرح محسنؔ,itne achchhe kyuun lagte ho
ہے آرزو کہ ہم دم وہ ماہ رو ہو میرا,mile gar mujh ko mulk e khusravi aur taj e kausi
کیا جرأتیں جو ہم کو درباں تمہارا ٹوکے,char su hai badi vahshat ka saman
زنجیر عاشقی کا دیوانہ ہو رہا ہوں,sabza o barg o lala rakhte hain
جس نے دانستہ کیا ہو نظر انداز وسیمؔ,kisi ka dil dukhane hi ko phir apni zaban kyuun ho
جب بھی چڑھتے ہویے دریا میں سفینہ اترا,tire mathe tire bistar ki shikan bhi ab ke
وہی صدیوں کی تیاری کرے ہے,kaise bachchon ko bataun raston ke pech o kham
وہ جھوٹ نہ بولے گا مرے سامنے آ کر,zakhm ke phuul se taskin talab karti hai
فرش سے تا عرش واں طوفاں تھا موج رنگ کا,jis ko dil kahte the so tiir ka paikan nikla
سینہ جویایے زخم کاری ہے,qafas men huun gar achchha bhi na janen mere shevan ko
سر بہ سر یہ فراز مہر و قمر,mai kadon ke bhi hosh udne lage
او دل بیمار کیوں کیسی کہی,mujhe jazb e dil ne ai juz bahak ke rakha qadam koi
اللہ نگہبان یہاں بھی ہے وہاں بھی,likha hua kirdar kahani men hi chalta phirta hai
سایل ہویے تو عاشق اہل کرم ہویے,liye baitha hai ik do chaar jam e vazh gun vo bhi
دیر نہیں حرم نہیں در نہیں آستاں نہیں,dil laga kar lag gaya un ko bhi tanha baithna
دلوں کا شور ہوا کو ہراس کیا دے گا,kaash koi ham se bhi puchhe
جو اس شور سے میرؔ روتا رہے گا,dilli ke na the kuche auraq e musavvar the
غالبا میں کسی کو بھول گیا,akhirash khuun bhi to paani hai
میں اپنے آپ میں نہ ملا اس کا غم نہیں,yuun ho ki aur hi koi havva mile mujhe
کیا کہوں تم سے میں کہ کیا ہے عشق,'mir' ji zard hote jaate ho
دلا یہ درد و الم بھی تو مغتنم ہے کہ آخر,sad rah ahang e zamin bos e qadam hai ham ko
قاصد سے ہے تکرار نہ جھگڑا ہے صبا سے,jaan se pahle dil liya tu ne
یہ اسی کے قلب سے پوچھیے جسے فخر ہو غم یار پر,kaaba nazar aaya na kalisa nazar aaya
ایک تو اتنا حبس ہے پھر میں سانسیں روکے بیٹھا ہوں,bolte kyuun nahin mire haq men
مگر یہ روز گیی بات چھیڑ دیتی ہے,kuchh ba mushkil dam e sahar aae
میرا سفر بہ طالع چشم حسود تھا,qadr e sang e sar e rah rakhta huun
لوگ کہتے تھے کہ سب وقت گزر جاتے ہیں,jo dekhne men bahut hi qarib lagta hai
کیسا جواب حضرت دل دیکھیے ذرا,ye mushtaq e shahadat kis jagah jaaen kise dhunden
دفتر ہے ایک معنی بے لفظ و صوت کا,duniya ke sitam yaad na apni hi vafa yaad
دیکھنا یہ ہے کہ بے لاگ سخن کس کا ہے,sharminda hon kyuun ghair ke ehsan o ata se
پسینہ توسن ہمت تو سیل خانۂ زیں ہے,aa ai bahar e naz ki tere khiram se
تجھ سے مطلب ہے نہیں دنیا و عقبی سے غرض,kya janiye zaban se kya nikle be khudi men
دو قدم مجھ سے بھی آگے مری رسوایی ہے,libas e jan men nahin shoalagi ka rang magar
وقت کی دھوپ میں تمہارے لیے,khud ko dauran e hal men apne
غالبؔ صریر خامہ نوایے سروش ہے,khuli hain ankhen magar badan hai tamam patthar
اے ولیؔ کیوں سن سکے ناصح کی بات,hua hai dil sanam ka be qarar ahista ahista
اب چاک کبھی جیب و گریباں نہ کریں گے,ab chaak kabhi jeb o gareban na karenge
بال شیشے کا رگ سنگ فساں ہوجایے گا,nisyah o naqd e do alam ki haqiqat malum
پرستش کی یاں تک کہ اے بت تجھے,sunte hain laila ke kheme ko siyah
زیست سے تنگ ہو اے داغؔ تو جیتے کیوں ہو,vahm aate hain dekhiye kya ho
شمع بجھتی ہے تو اس میں سے دھواں اٹھتا ہے,shakeb o sabr e ahl e anjuman ki azmaish hai
یہاں تو پاؤں سے صحرا نکل رہا ہے میاں,ab yahi soch liya dil men ki manzil ke baghair
عجب فتور سا ہر وقت سر میں رہتا ہے,khuda ke haath men mat saunp saare kamon ko
قافلے پھر حرم کو جانے لگے,hamari chashm e dariya bar se puchh
یہ مرا خون ہے شراب نہیں,ek ka naam navazinda tha aur ik ka bazinda tha
اور آگے دب چکے ہیں تلے گل کے چار پانچ,shishe hain ye to zahr e halahal ke chaar panch
سوچتا ہوں ترے آنچل کا کنارا ہی نہ ہو,baitha likkhun kaghaz par
یہ کیوں باقی رہے آتش زنو یہ بھی جلا ڈالو,"bhikshu dani, pyasa pani, dariya sagar, jal gagar"
یہ رقم نہ ہاتھ لگتی نہ یہ افتخار ہوتا,goya ki lab se ho ke kuchh irshad rah gaya
خیاباں خیاباں ارم دیکھتے ہیں,ho liye kyuun nama bar ke saath saath
غار کے منہ پہ رکھا رہنے دو سنگ خورشید,raat bhar baten karte hain taare
عشق کیوں درمیان ہے پیارے,jis men firdaus ke nazare hain
تڑپ جاییے گا جو تڑپاییے گا,kahan tak tabiat ko behlaiyega
فراقؔ اس گردش ایام سے کب کام نکلا ہے,dil dukhe roe hain shayad is jagah ai ku e dost
